BOAMP_AVIS_NUM,D_14_01_Conditionparticipationsystmequalif_Conditions,D_14_02_Conditionparticipationsystmequalif_Methodeverification
17-131362,Se référer au règlement de la consultation.,Se référer au règlement de la consultation.
17-138122,Le dossier de consultation sera adressé aux entreprises qui en feront la demande par courriel à thlegendre@free.fr,
17-138254,- Situation juridique - références requises : DC1 ou document équivalent.- Capacité économique et financière - références requises : DC2 ou documents équivalents,
17-141380,CF CCAP,CF CCAP
17-143583,Remise des certificats de qualification,Interrogation des organismes qualifiants pour vérifier la véracité de ces certificats
