BOAMP_AVIS_NUM,D_10_01_Annulation_Annulinfoannonceanterieur,D_10_01_01_Annulation_Annulinfoannonceanterieur_Reference,D_10_01_01_01_Annulation_Annulinfoannonceanterieur_Reference_Idweb,D_10_01_01_02_Annulation_Annulinfoannonceanterieur_Reference_Typeavis,D_10_01_01_02_01_Annulation_Annulinfoannonceanterieur_Reference_Typeavis_Famille,D_10_01_01_02_01_01_Annulation_Annulinfoannonceanterieur_Reference_Typeavis_Famille_Mapa,D_10_01_01_02_01_02_Annulation_Annulinfoannonceanterieur_Reference_Typeavis_Famille_Fns,D_10_01_01_02_01_03_Annulation_Annulinfoannonceanterieur_Reference_Typeavis_Famille_Joue,D_10_01_01_02_01_04_Annulation_Annulinfoannonceanterieur_Reference_Typeavis_Famille_Dsp,D_10_01_01_02_01_05_Annulation_Annulinfoannonceanterieur_Reference_Typeavis_Famille_Divers,D_10_01_01_02_02_Annulation_Annulinfoannonceanterieur_Reference_Typeavis_Perimetre,D_10_01_01_02_02_01_Annulation_Annulinfoannonceanterieur_Reference_Typeavis_Perimetre_Cmp2006,D_10_01_01_02_02_02_Annulation_Annulinfoannonceanterieur_Reference_Typeavis_Perimetre_Cmp2006DEFENSE,D_10_01_01_02_02_03_Annulation_Annulinfoannonceanterieur_Reference_Typeavis_Perimetre_Directive18,D_10_01_01_02_02_04_Annulation_Annulinfoannonceanterieur_Reference_Typeavis_Perimetre_Directive17,D_10_01_01_02_02_05_Annulation_Annulinfoannonceanterieur_Reference_Typeavis_Perimetre_Directive81,D_10_01_01_02_02_06_Annulation_Annulinfoannonceanterieur_Reference_Typeavis_Perimetre_Directive23,D_10_01_01_02_02_07_Annulation_Annulinfoannonceanterieur_Reference_Typeavis_Perimetre_Directive24,D_10_01_01_02_02_08_Annulation_Annulinfoannonceanterieur_Reference_Typeavis_Perimetre_Directive25,D_10_01_01_02_02_09_Annulation_Annulinfoannonceanterieur_Reference_Typeavis_Perimetre_Dsp,D_10_01_01_02_02_10_Annulation_Annulinfoannonceanterieur_Reference_Typeavis_Perimetre_Autre,D_10_01_01_02_03_Annulation_Annulinfoannonceanterieur_Reference_Typeavis_Nature,D_10_01_01_02_03_01_Annulation_Annulinfoannonceanterieur_Reference_Typeavis_Nature_Preinformation,D_10_01_01_02_03_02_Annulation_Annulinfoannonceanterieur_Reference_Typeavis_Nature_Profilacheteur,D_10_01_01_02_03_03_Annulation_Annulinfoannonceanterieur_Reference_Typeavis_Nature_Appeloffre,D_10_01_01_02_03_03_01_Annulation_Annulinfoannonceanterieur_Reference_Typeavis_Nature_Appeloffre_Standard,D_10_01_01_02_03_03_02_Annulation_Annulinfoannonceanterieur_Reference_Typeavis_Nature_Appeloffre_Concours,D_10_01_01_02_03_03_03_Annulation_Annulinfoannonceanterieur_Reference_Typeavis_Nature_Appeloffre_Periodique,D_10_01_01_02_03_03_04_Annulation_Annulinfoannonceanterieur_Reference_Typeavis_Nature_Appeloffre_Qualification,D_10_01_01_02_03_03_05_Annulation_Annulinfoannonceanterieur_Reference_Typeavis_Nature_Appeloffre_Sad,D_10_01_01_02_03_03_06_Annulation_Annulinfoannonceanterieur_Reference_Typeavis_Nature_Appeloffre_Concession,D_10_01_01_02_03_03_07_Annulation_Annulinfoannonceanterieur_Reference_Typeavis_Nature_Appeloffre_Concessionnaire,D_10_01_01_02_03_04_Annulation_Annulinfoannonceanterieur_Reference_Typeavis_Nature_Intentionconclure,D_10_01_01_02_03_05_Annulation_Annulinfoannonceanterieur_Reference_Typeavis_Nature_Attribution,D_10_01_01_02_03_05_01_Annulation_Annulinfoannonceanterieur_Reference_Typeavis_Nature_Attribution_Standard,D_10_01_01_02_03_05_02_Annulation_Annulinfoannonceanterieur_Reference_Typeavis_Nature_Attribution_Concours,D_10_01_01_02_03_05_03_Annulation_Annulinfoannonceanterieur_Reference_Typeavis_Nature_Attribution_Concession,D_10_01_01_02_03_05_04_Annulation_Annulinfoannonceanterieur_Reference_Typeavis_Nature_Attribution_Standardinfructueuxsanssuite,D_10_01_01_02_03_06_Annulation_Annulinfoannonceanterieur_Reference_Typeavis_Nature_Soustraitance,D_10_01_01_02_03_07_Annulation_Annulinfoannonceanterieur_Reference_Typeavis_Nature_Modification,D_10_01_01_02_03_08_Annulation_Annulinfoannonceanterieur_Reference_Typeavis_Nature_Qualification,D_10_01_01_02_03_09_Annulation_Annulinfoannonceanterieur_Reference_Typeavis_Nature_Rectificatif,D_10_01_01_02_03_10_Annulation_Annulinfoannonceanterieur_Reference_Typeavis_Nature_Periodique,D_10_01_01_02_03_11_Annulation_Annulinfoannonceanterieur_Reference_Typeavis_Nature_Autre,D_10_01_01_02_04_Annulation_Annulinfoannonceanterieur_Reference_Typeavis_Statut,D_10_01_01_02_04_01_Annulation_Annulinfoannonceanterieur_Reference_Typeavis_Statut_Initial,D_10_01_01_02_04_02_Annulation_Annulinfoannonceanterieur_Reference_Typeavis_Statut_Rectificatif,D_10_01_01_02_04_03_Annulation_Annulinfoannonceanterieur_Reference_Typeavis_Statut_Annulation,D_10_01_01_02_04_04_Annulation_Annulinfoannonceanterieur_Reference_Typeavis_Statut_Modification,D_10_01_01_03_Annulation_Annulinfoannonceanterieur_Reference_Dateenvoi,D_10_01_02_Annulation_Annulinfoannonceanterieur_Referencepublication,D_10_01_02_01_Annulation_Annulinfoannonceanterieur_Referencepublication_Publicationpapier,D_10_01_02_02_Annulation_Annulinfoannonceanterieur_Referencepublication_Publicationelectronique,D_10_01_02_02_01_Annulation_Annulinfoannonceanterieur_Referencepublication_Publicationelectronique_Datepublication,D_10_01_02_02_02_Annulation_Annulinfoannonceanterieur_Referencepublication_Publicationelectronique_Datefindiffusion,D_10_01_02_03_Annulation_Annulinfoannonceanterieur_Referencepublication_Publicationjoue,D_10_01_02_03_01_Annulation_Annulinfoannonceanterieur_Referencepublication_Publicationjoue_Annee,D_10_01_02_03_02_Annulation_Annulinfoannonceanterieur_Referencepublication_Publicationjoue_Numparution,D_10_01_02_03_03_Annulation_Annulinfoannonceanterieur_Referencepublication_Publicationjoue_Numannonce,D_10_01_02_03_04_Annulation_Annulinfoannonceanterieur_Referencepublication_Publicationjoue_Datepublication,D_10_02_Annulation_Motif
17-177107,CF_NIV_SUIV,CF_NIV_SUIV,17-176085,CF_NIV_SUIV,CF_NIV_SUIV,True,False,False,,,CF_NIV_SUIV,True,,,,False,,,,,,CF_NIV_SUIV,,,CF_NIV_SUIV,,,,,,,,,CF_NIV_SUIV,,,,,,,,,,,CF_NIV_SUIV,True,,,,,CF_NIV_SUIV,[],CF_NIV_SUIV,2017-12-14 23:00:00,2018-02-01 23:00:00,CF_NIV_SUIV,,,,,Une autre annonce a été publiée : N°3208502
17-177112,CF_NIV_SUIV,CF_NIV_SUIV,17-167359,CF_NIV_SUIV,CF_NIV_SUIV,True,False,False,,,CF_NIV_SUIV,True,,,,False,,,,,,CF_NIV_SUIV,,,CF_NIV_SUIV,,,,,,,,,CF_NIV_SUIV,,,,,,,,,,,CF_NIV_SUIV,True,,,,,CF_NIV_SUIV,[],CF_NIV_SUIV,2017-11-27 23:00:00,2018-01-04 23:00:00,CF_NIV_SUIV,,,,,"La présente consultation étant passée dans un domaine couvert par le Groupement de commande du SIPPEREC dont la Ville est membre, celle-ci ne peut donc être légalement menée à terme. La Ville a en effet l'obligation de signer avec le cocontractant retenu par le groupement un marché à hauteur de ses besoins propres pour les prestations couverte par le groupement. C'est pourquoi il ne sera pas donné suite à la présente procédure. Cette déclaration sans suite pourra faire l'objet, d'un recours gracieux, ou conformément à l'article R 421-1 du Code de Justice Administrative, d'un recours auprès du tribunal administratif de Melun dans un délai de deux (2) mois à compter de la publication de celle-ci."
17-177899,CF_NIV_SUIV,CF_NIV_SUIV,17-106941,CF_NIV_SUIV,CF_NIV_SUIV,True,False,False,,,CF_NIV_SUIV,True,,,,False,,,,,,CF_NIV_SUIV,,,CF_NIV_SUIV,,,,,,,,,CF_NIV_SUIV,,,,,,,,,,,CF_NIV_SUIV,True,,,,,CF_NIV_SUIV,[],CF_NIV_SUIV,2017-07-25 22:00:00,2017-10-01 22:00:00,CF_NIV_SUIV,,,,,"Le marché est déclaré sans suite, suite à une erreur de calcul du critère 'délai de garantie' indiqué dans le règlement de la consultation."
17-177952,CF_NIV_SUIV,CF_NIV_SUIV,17-177641,CF_NIV_SUIV,CF_NIV_SUIV,False,True,False,,,CF_NIV_SUIV,True,,,,False,,,,,,CF_NIV_SUIV,,,CF_NIV_SUIV,,,,,,,,,CF_NIV_SUIV,,,,,,,,,,,CF_NIV_SUIV,True,,,,,CF_NIV_SUIV,[],CF_NIV_SUIV,2017-12-17 23:00:00,2018-03-17 23:00:00,CF_NIV_SUIV,,,,,La présente procédure est déclarée sans suite pour motif d'intérêt général.
17-178155,CF_NIV_SUIV,CF_NIV_SUIV,17-175571,CF_NIV_SUIV,CF_NIV_SUIV,False,True,False,,,CF_NIV_SUIV,True,,,,False,,,,,,CF_NIV_SUIV,,,CF_NIV_SUIV,,,,,,,,,CF_NIV_SUIV,,,,,,,,,,,CF_NIV_SUIV,True,,,,,CF_NIV_SUIV,[],CF_NIV_SUIV,2017-12-17 23:00:00,2018-01-30 23:00:00,CF_NIV_SUIV,,,,,"L'avis publié au BOAMP no17-175571, du 18/12/2017 au 31/01/2018, est annulé suite à une erreur matérielle concernant les supports de publications requis par la réglementation. Un nouvel avis sera publié dans les jours à venir."
17-179178,CF_NIV_SUIV,CF_NIV_SUIV,17-151355,CF_NIV_SUIV,CF_NIV_SUIV,False,True,False,,,CF_NIV_SUIV,True,,,,False,,,,,,CF_NIV_SUIV,,,CF_NIV_SUIV,,,,,,,,,CF_NIV_SUIV,,,,,,,,,,,CF_NIV_SUIV,True,,,,,CF_NIV_SUIV,[],CF_NIV_SUIV,2017-10-24 22:00:00,2017-11-26 23:00:00,CF_NIV_SUIV,,,,,"La CPAM du Rhône a décidé de déclarer sans suite pour motif d'intérêt général, constitué par l'insuffisance de concurrence, du fait de la réception d'une seule offre. (CJCE 16 septembre 1999, Metalmeccanica Fracasso SpA, Aff. C-27/98)."
17-179427,CF_NIV_SUIV,CF_NIV_SUIV,17-178763,CF_NIV_SUIV,CF_NIV_SUIV,False,True,False,,,CF_NIV_SUIV,True,,,,False,,,,,,CF_NIV_SUIV,,,CF_NIV_SUIV,,,,,,,,,CF_NIV_SUIV,,,,,,,,,,,CF_NIV_SUIV,True,,,,,CF_NIV_SUIV,[],CF_NIV_SUIV,2017-12-19 23:00:00,2018-01-23 23:00:00,CF_NIV_SUIV,,,,,Ce marché a été publié par erreur au niveau national. Il doit également être au niveau européen > JOUE et BOAMP.
17-179439,CF_NIV_SUIV,CF_NIV_SUIV,17-178733,CF_NIV_SUIV,CF_NIV_SUIV,False,True,False,,,CF_NIV_SUIV,True,,,,False,,,,,,CF_NIV_SUIV,,,CF_NIV_SUIV,,,,,,,,,CF_NIV_SUIV,,,,,,,,,,,CF_NIV_SUIV,True,,,,,CF_NIV_SUIV,[],CF_NIV_SUIV,2017-12-19 23:00:00,2018-01-23 23:00:00,CF_NIV_SUIV,,,,,Marché publié au BOAMP au lieu de BOAMP + JOUE
17-179444,CF_NIV_SUIV,CF_NIV_SUIV,17-178015,CF_NIV_SUIV,CF_NIV_SUIV,False,True,False,,,CF_NIV_SUIV,True,,,,False,,,,,,CF_NIV_SUIV,,,CF_NIV_SUIV,,,,,,,,,CF_NIV_SUIV,,,,,,,,,,,CF_NIV_SUIV,True,,,,,CF_NIV_SUIV,[],CF_NIV_SUIV,2017-12-19 23:00:00,2018-01-23 23:00:00,CF_NIV_SUIV,,,,,Marché publié au BOAMP uniquement au lieu de BOAMP + JOUE
17-180383,CF_NIV_SUIV,CF_NIV_SUIV,17-173971,CF_NIV_SUIV,CF_NIV_SUIV,False,True,False,,,CF_NIV_SUIV,True,,,,False,,,,,,CF_NIV_SUIV,,,CF_NIV_SUIV,,,,,,,,,CF_NIV_SUIV,,,,,,,,,,,CF_NIV_SUIV,True,,,,,CF_NIV_SUIV,[],CF_NIV_SUIV,2017-12-10 23:00:00,2018-01-25 23:00:00,CF_NIV_SUIV,,,,,"Le marché construction du Centre Technique Municipal fait l'objet d'une déclaration sans suite au motif d'une erreur matériel de mise en ligne de documents sur la plate-forme. Dans l'intérêt général du pouvoir adjudicateur, au regard du respect des procédures de passation des marchés publics et d'égalité de traitement des candidats, le marché est déclaré sans suite."
17-180947,CF_NIV_SUIV,CF_NIV_SUIV,17-168247,CF_NIV_SUIV,CF_NIV_SUIV,True,False,False,,,CF_NIV_SUIV,True,,,,False,,,,,,CF_NIV_SUIV,,,CF_NIV_SUIV,,,,,,,,,CF_NIV_SUIV,,,,,,,,,,,CF_NIV_SUIV,True,,,,,CF_NIV_SUIV,[],CF_NIV_SUIV,2017-11-28 23:00:00,2017-12-14 23:00:00,CF_NIV_SUIV,,,,,"En application du décret no2016-360 du 25 mars 2016 relatif au marché public et compte tenu d'incohérences entre plusieurs pièces du dossier de consultation des entreprises (DCE), cette consultation fait l'objet d'une déclaration sans suite pour motif d'intérêt général aux fins de mettre un terme à une procédure entachée d'irrégularité."
17-181687,CF_NIV_SUIV,CF_NIV_SUIV,17-179026,CF_NIV_SUIV,CF_NIV_SUIV,False,True,False,,,CF_NIV_SUIV,True,,,,False,,,,,,CF_NIV_SUIV,,,CF_NIV_SUIV,,,,,,,,,CF_NIV_SUIV,,,,,,,,,,,CF_NIV_SUIV,True,,,,,CF_NIV_SUIV,[],CF_NIV_SUIV,2017-12-19 23:00:00,2018-01-23 23:00:00,CF_NIV_SUIV,,,,,"Erreur de publication - omission de publier au JOUE.Un 2ème avis avec le même objet et les mêmes conditions est publié au BOAMP (no de publication : 17-179971), JOUE, Moniteur et Dauphiné.Date limite de remise des offres sur le 2ème avis : 24/01/2018 à 17h00"
17-181907,CF_NIV_SUIV,CF_NIV_SUIV,17-173387,CF_NIV_SUIV,CF_NIV_SUIV,False,True,False,,,CF_NIV_SUIV,True,,,,False,,,,,,CF_NIV_SUIV,,,CF_NIV_SUIV,,,,,,,,,CF_NIV_SUIV,,,,,,,,,,,CF_NIV_SUIV,True,,,,,CF_NIV_SUIV,[],CF_NIV_SUIV,2017-12-07 23:00:00,2017-12-19 23:00:00,CF_NIV_SUIV,,,,,"Procédure déclarée sans suite pour motif de nouvelle et meilleure évaluation des besoins, conformément à l'article 98 du décret no2016-360 du 25 mars 2016 relatif aux marchés publics."
17-182399,CF_NIV_SUIV,CF_NIV_SUIV,17-180631,CF_NIV_SUIV,CF_NIV_SUIV,False,True,False,,,CF_NIV_SUIV,True,,,,False,,,,,,CF_NIV_SUIV,,,CF_NIV_SUIV,,,,,,,,,CF_NIV_SUIV,,,,,,,,,,,CF_NIV_SUIV,True,,,,,CF_NIV_SUIV,[],CF_NIV_SUIV,2017-12-21 23:00:00,2018-01-29 23:00:00,CF_NIV_SUIV,,,,,Au regard d'une anomalie technique et informatique cet publicité fait l'objet d'une annulation.Cependant le marché fait toujours l'objet d'un appel à candidature dont les pièces sont téléchargeables à l'adresse suivante.www.achatpublic.com/sdm/ent/gen/ent_detail.do?PCSLID=CSL_2017_WAqpzu2OwT&v=1&selected=0Il est précisé qu'une nouvelle publicité à été relancée pour ce marché sous a référence '3211536'
17-182988,CF_NIV_SUIV,CF_NIV_SUIV,17-74281,CF_NIV_SUIV,CF_NIV_SUIV,False,True,False,,,CF_NIV_SUIV,True,,,,False,,,,,,CF_NIV_SUIV,,,CF_NIV_SUIV,,,,,,,,,CF_NIV_SUIV,,,,,,,,,,,CF_NIV_SUIV,True,,,,,CF_NIV_SUIV,[],CF_NIV_SUIV,2017-05-28 22:00:00,2017-07-16 22:00:00,CF_NIV_SUIV,,,,,Déclaration sans suite en raison de l'évolution des besoins en matière de respect de l'environnement
17-182992,CF_NIV_SUIV,CF_NIV_SUIV,17-85901,CF_NIV_SUIV,CF_NIV_SUIV,True,False,False,,,CF_NIV_SUIV,True,,,,False,,,,,,CF_NIV_SUIV,,,CF_NIV_SUIV,,,,,,,,,CF_NIV_SUIV,,,,,,,,,,,CF_NIV_SUIV,True,,,,,CF_NIV_SUIV,[],CF_NIV_SUIV,2017-06-18 22:00:00,2017-07-20 22:00:00,CF_NIV_SUIV,,,,,Déclaration sans suite en raison d'un problème de délai de résiliation de l'ancien contrat.
